model,dataset,topic_id,doc_id,doc_text_short
CTM,UGC,5,250,"איזו בחורה מרשימה . כתבה מעולה, בחורה סופר חכמה ומיוחדת. רק בת והספיקה לעשות כל כך הרבה דברים טובים ובעיקר משמעותיים בחייה, כיף וגאווה שיש לנו אנשים כמוה בארץ. בהצלחה."
CTM,UGC,6,127,אדלשטיין גרוע יותר מליצמן . ההדבקה היא במקומות סגורים תחבורה ציבורית עירונית שם ההדבקה זה קטסטרופה ראיתם מה קורה לדוגמא בקו אין פיקוח הנהג לא יכול להעיר ולא לעלות אנשים ללא מסיכה כי לא עולים בדלת הקידמית בצדק .שם תשימו פקחים שישגיחו שכולם עם מסיכות ולא תהייה צפיפות יותר אוטובוסים רק משם ההדבקה הגדולה והים זה תוספת ומרכזי קניות סגורים זה תוספת ההדבקה הגדולה זה באוטובוסים וחוסר משמעת
CTM,UGC,6,2319,להפיק את האוטובוסים הציבוריים מיד . סכנת חיים לנוסעים ולנהגים חייבים לסגור את כל התחבורה הציבורית בכלל ואוטובוסים בפרט. בגלל הפקקים השהות באוטובוס ארוכה חלק מהאנשים שנסעו בלי מסכה אומנם ירדו בתחנה אך השאירו את החיידקים והוירוסים להתעוףף בתוך האוטובוס סכנה זכרו איך בחורף כל החלונות אדים איכססס בקיץ לא רואים את זה אבל כל הוירוסים והחיידקים שם אוטובוסים לסגור עכשיו.
CTM,UGC,6,3878,אכיפה באטובוסים העירוניים תפסיקו לרדוף אנשים ברחוב ללא מסיכה שם ההדבקה מועטה תפקחו על מקומות של התקהלות ללא מסיכה ותציבו פקחים על האוטובוסים שם ההדבקה הנוראית הנהג לא יכוללפקח הוא צריך להיות עירני בכביש תחייבו כל המעסיקים שהעובדים שלהם יעבדו מהבית אז פחות אנשים יהיו בתחבורה הציבורית זה ימזער ההדבקות יש מובטלים שהמדינה תעסיק אותם להיות פקחים גם ככה משלמים אבטלה אז שיצאו לעבוד וידאגו לנושא הזה
CTM,UGC,7,1975,ככה מכחישים את החיסונים הממוסחרים !!! . מרגע הגילוי תחילת דצמבר.. הרופא היה אמור להיזהר . איך הוא נדבק אם לבש הגנות . הוא ידע בדצמבר וחלה בינואר עם כל ההגנות?!!!!.יכול להיות שכבר היה חולה והדגירה היא יותר מ יום ?!!!!כלומר יום.מה שיודעים שיש חולים בפועל שהגיעו ואובחנו . מה עם חולים אחרים ? מה עם נשאים אחרים . נניח שיש רק חולים מחצית הגיעו לבית החולים ואובחנו.. אז יש נשאים של שהסתובבו חודשיים יום וה
CTM,UGC,7,1389,"הצוות הרפואי . מה ההגיון בבידוד רופא שאינו חולה ורק קיים חשש שנחשף לחולי קורונה? הרופא יכול לטפל בחולי קורונה, להמשיך להיות ממוגן ללון ולהיות בהפסקה בביהח במקום בבית. למה להשבית אנשים שלא בוודאות חלו ולמוטט את שאר הצוות ."
CTM,UGC,7,1386,"הפקרות . סגרו את המחלקה הנירולוגית בשביל להקים מחלקת קורונה, העבירו את כל החולים הנירולוגים למחלקות פנימיות ועכשיו מסתבר שיש חולי קורנה מסתובבים בכל מחלקות בית החולים אם מישהו יודע באיזה מחלקה בוולפסון זה קרה שנדע אם אנחנו בתור מבקרים צריכים להכנס לבידוד כי משרד הבריאות לא מכיר כזה דיוח"
CTM,UGC,8,174,"אור יקרה,אני משתתפת בצערך ובצער המשפחה על פטירתו של סבא משה . לבי איתך ועם המשפחה.עצוב מאד .אני שולחת לכם את תנחומי ושלא תדעו יותר צער.חיבוק גדול ממני .מאחלת חכם בריאות.החלמה מהירה ומלאה לאמא .תשמרו על עצמכם יקרים!"
CTM,UGC,8,39,קורונה . ברוך דיין האמת עם ישראל לצערנו נגזר עליהם לצערנו מיתה המגפה הזו משמיים עם כל הכאב כאמא נקווה שהם יהיו אחרונות תפילות על כל עם ישראל ואנושות כולה להרבות בגמילות חסד וה יושיע אותנו הקדוש ברוך שומע תפילת כל פה אחדות בעם ישראל שיהיה אמן
CTM,UGC,8,4455,"כואב כל כך לקרוא את הדברים...תנוחמו מהשמיים בעזרת השם. תודה לצוות הרפואי שעושה ימים כלילות כדי להציל כמה שיותר. שלא תדעו עוד צער, משתתף בצער המשפחות. מרגש ויפה שקראתם תהילים ותפילות, זה מה שיעזור לנשמה שלמעלה, לא להתייאש ולהמשיך עם התהילים והתפילות בכל זמן."
CTM,UGC,9,4548,לא נקבל את זה שפושע יושב ברשות הממשלהפושע לכלא! פושע לכלא! פושע לכלא! פושע לכלא! פושע לכלא! פושע לכלא! פושע לכלא! פושע לכלא! פושע לכלא! פושע לכלא! פושע לכלא! פושע לכלא! פושע לכלא! פושע לכלא! פושע לכלא! פושע לכלא! פושע לכלא! פושע לכלא! פושע לכלא! פושע לכלא! פושע לכלא! פושע לכלא! פושע לכלא! פושע לכלא! פושע לכלא! פושע לכלא! פושע לכלא! פושע לכלא! פושע לכלא! פושע לכלא! פושע לכלא! פושע לכלא! פושע לכלא! 
CTM,UGC,9,17,", אזרחים ותיקים עובדים ומשלמים מיסים ללא דמי אבטלה!ממשלת הליכוד שנות שילטון וקצבת הזיקנה ש ח לחודש !!!! בושה !!! פשע !!! שנות שלטון ואזרחים ותיקים שעובדים לא זכאים לדמי אבטלה !! בושה!! פשע !! אזרחים ותיקים, הפכתם להיות השקופים של ממשלת הרשע!! יש לכם פחות זכויות מהמסתננים מאפריקה!! אף אחד אפילו לא יורק לכיוונכם !! ובמיוחד מי שלא תמך בהעלאת קצבת זקנה הליכוד והשרה גילה גמליאל מהיום תצביעו רק למי שיתמ"
CTM,UGC,9,4208,"הליכוד נגד אזרחים ותיקים! שנות שילטון וקצבת הזיקנה ש ח לחודש !!!! בושה !!! פשע !!! שנות שלטון ואזרחים ותיקים שעובדים לא זכאים לדמי אבטלה !! בושה!! פשע !! אזרחים ותיקים, הפכתם להיות השקופים של ממשלת הרשע!! יש לכם פחות זכויות מהמסתננים מאפריקה!! אף אחד אפילו לא יורק לכיוונכם !! ובמיוחד מי שלא תמך בהעלאת קצבת זקנה הליכוד והשרה גילה גמליאל!! מהיום תצביעו רק למי שיתמוך באמנת האזרחים הוותיקים .קצבת זקנה"
CTM,UGC,10,3829,"איזה להגדיל מס???כל השנים המדינה מפוצצת במיסים, הררי מיסים שמגיעים ממס הכנסה אדיר, מע מ, וחליבה אינסופית והגבוהה בעולם של מיסי יבוא רכב ודלקים, ומיסי נדלן. המדינה מפוצצת במיסים, אבל הנבזות והשקרים קשורים בכלל בחלוקת הררי הכסף האלה!! תקציב ביטחון מנופח, לא יעיל וחסר פרופורציה, מיליציות של קבוצות אינטרס משרד הביטחון השמן על אלפי הג ובים המיותרים בו חברת חשמל, רשות שדות התעופה, מקורות, וועדי עובדי הנ"
CTM,UGC,10,5017,שי באבד הוא עושק. עוד מעט לחודש ואין כסף לתשלומיםלצערי שי באבד מקבל ממני משכורת וכנל כל הצמרות הבחירות כולל ראש הממשלה חכים ושרים. בכל העולם מתגייסים למען העסקים הקטנים. רק במדינת ישראל יש כסף לממשלות מנופחות סקטור ציבורי מנופח. ולעצמאיים אין כלום. עוד מעט ה לחודש מצפים מאיתנו לא לעבוד ולא יהיה כסף לשלם לכלום לא משכורות לא התחייבויות ולא כלום בחסות שי באבד וכל השאר אנחנו ניכנס לחדלות פירעון. פשוט 
CTM,UGC,10,5065,תזכרו טוב לא יגיע כלום לעצמאים! אולי כמה שקלים בודדים המדינה קורסת והמלך שלנו לוקח לעצמו הטבות מס של מיליונים. הממשלה מסדרת לעצמה ג ובים במאות אלפים לח כ ובינתיים חצי מדינה מובטלים לא סוגרים את החודש קריסה טוטאלית חוסר אמון בשילטון. אפילו השלטון המקומי איבד אמון בממשלה
CTM,UGC,11,2261,לא סתם הם רופאים צעירים
CTM,UGC,11,3402,קתולים ממש לא שורפים גופות
CTM,UGC,11,4344,זה לא קצר זה מולד...
