model,dataset,topic_id,doc_id,doc_text_short
CTM,Wiki,11,6338,"עֵין הַחוֹרֵשׁ הוא קיבוץ של תנועת הקיבוץ הארצי השומר הצעיר במחוז המרכז בישראל בין הערים נתניה וחדרה השייך למועצה אזורית עמק חפר. לפי אתר הקיבוץ, מתגוררים בקיבוץ נפש ושטחו כ , דונם. היסטוריה קיבוץ עין החורש נוסד בשנת במושבה חדרה, על ידי בוגרי השומר הצעיר מפולין, ובהמשך הצטרפו אליו בוגרי השומר הצעיר מבלגיה. הוא היה הראשון לקיבוצי השומר הצעיר מהעלייה החמישית. חברי הקיבוץ הקימו משק עזר חקלאיו גילו יזמ"
CTM,Wiki,12,11818,"הפועל פתח תקווה היא קבוצת כדורגל ישראלית מהעיר פתח תקווה, המשחקת בליגת העל. צבעי הקבוצה הם כחול ולבן ומגרשה הביתי הוא אצטדיון המושבה. אגודת הספורט של הפועל פתח תקווה נוסדה בשנת ומועדון הכדורגל הוקם ב . היסטורית, הפועל פתח תקווה הוא אחד ממועדוני הכדורגל המובילים בארץ. בעונת זכתה הקבוצה לראשונה בתולדותיה באליפות המדינה ובין השנים זכתה הקבוצה בחמש אליפויות ברצף, שיא בכדורגל הישראלי שטרם נשבר. בנוסף ה"
CTM,Wiki,12,23738,"נבחרת כדורגל הנשים של גרמניה היא נבחרת כדורגל הנשים הלאומית של גרמניה. הנבחרת מנוהלת על ידי התאחדות הכדורגל הגרמנית, ומייצגת את גרמניה במשחקי ידידות נגד נבחרות לאומית אחרות, וכן בטורנירים בינלאומיים כמו אליפות אירופה בכדורגל נשים, גביע העולם בכדורגל נשים, ליגת האומות של אופ א לנשים ובמשחקים האולימפיים. הנבחרת הגרמנית היא הנבחרת המדורגת שנייה במידת הצלחתה ההיסטורית אחרי נבחרת ארצות הברית. הנבחרת זכ"
CTM,Wiki,12,11344,"מועדון הכדורגל ליברפול באנגלית . . הוא מועדון כדורגל אנגלי מהעיר ליברפול, המשחק בפרמייר ליג, הליגה הבכירה של הכדורגל באנגליה. ליברפול היא הקבוצה האנגלית המצליחה ביותר במאה ה־ , אחת הקבוצות המצליחות ביותר בתולדות הכדורגל האנגלי, ומדורגת במקום השלישי באירופה מבחינת הישגיה עם שש זכיות בגביע אירופה לאלופות, שלוש זכיות בגביע אופ א וארבע זכיות בסופר קאפ האירופי. ליברפול מחזיקה בשיא הזכיות בגביע הליגה הא"
CTM,Wiki,13,18650,"שלמה וינר נולד ב בספטמבר הוא משורר עברי, מורה ומתמטיקאי ואיש חינוך מתמטי. ביוגרפיה נולד בירושלים בשנת תרצ ח . את שלושת תאריו במתמטיקה למד וקיבל מהאוניברסיטה העברית בירושלים. את הדוקטורט עשה בהנחיית פרופסור עזריאל לוי. סיים לימודי המשך באוניברסיטת ברקלי, חזר ללמד מתמטיקה באוניברסיטה העברית בירושלים, וחקר בה את תחום הוראת המתמטיקה במשך למעלה משלושים שנה, וכיהן פעמיים כראש החוג להוראת המתמטיקה בתקופה"
CTM,Wiki,13,7279,"נילי כהן נולדה ב היא פרופסור אמריטה למשפטים באוניברסיטת תל אביב, רקטור האוניברסיטה לשעבר, חברת האקדמיה הלאומית הישראלית למדעים משנת ונשיאת האקדמיה בשנים . כלת פרס ישראל לחקר המשפט לשנת ה תשע ז. ביוגרפיה נולדה בכפר סבא כנילי גרבלסקי. למדה בתיכון עירוני ד בתל אביב. השתחררה מצה ל בדרגת סגן. למדה במחזור הראשון למשפטים באוניברסיטת תל אביב. בשנת סיימה לימודי תואר ראשון באוניברסיטה בהצטיינות. קריירה בתקו"
CTM,Wiki,13,11266,"מריו מיקולינסר נולד ב הוא פרופסור וחוקר ישראלי בתחום הפסיכולוגיה, ששימש דיקן בית הספר לפסיכולוגיה ובין השנים עד המשנה לנשיא לעניינים אקדמיים של המרכז הבינתחומי . זוכה פרס א.מ.ת לשנת . כיום מריו ראש התכנית לתואר שלישי בפסיכולוגיה באוניברסיטת רייכמן. מיקולינסר ביוגרפיה מיקולינסר נולד בסנטה פה שבארגנטינה בשנת . עלה לישראל בגיל . בשנת סיים לימודים לתואר דוקטור בפסיכולוגיה באוניברסיטת בר אילן. כ שנים ל"
CTM,Wiki,14,14611,"ליגוריה באיטלקית הוא מחוז חוף בצפון מערב איטליה. המחוז גובל בצרפת במערב, במחוז פיימונטה בצפון ובאמיליה רומאניה ובטוסקנה במזרח. המחוז שוכן על חופיו של הים הליגורי, חלקו הצפוני של הים התיכון, ונחשב לעיקר שטחה של הריביירה האיטלקית . בירת המחוז היא העיר ג נובה. גאוגרפיה ואקלים המרכיבים הבולטים בגאוגרפיה של ליגוריה הם חוף הים הליגורי, הרי האפנינים שבצפון מזרח המחוז והרי האלפים שבצפון מערב המחוז. גובה ק"
CTM,Wiki,14,6436,"חצי האי ערב בערבית הוא חצי האי הגדול ביותר בעולם אשר נמצא בדרום מערב אסיה, בצומת שבין אפריקה לאסיה, מזרחית לאריתריאה וצפונית לסומליה, מדרום לישראל ולירדן, ודרום מערבית לאיראן. חופי חצי האי ערב הם הים האדום מדרום מערב ומפרץ אילת הידוע גם בשם מפרץ עקבה בשפות שונות , הים הערבי מדרום מזרח ומפרץ עומאן והמפרץ הפרסי מצפון מזרח. חלוקה מדינית בחצי האי ערב נמצאות המדינות קטר כמו כן, כחלק מהאזור הגאוגרפי של "
CTM,Wiki,14,1903,"גבולותיו של הים התיכון מבט על הים התיכון בין גדות מצר גיברלטר אשר מחבר בין הים התיכון לבין האוקיינוס האטלנטי הים התיכון הוא ים בין יבשתי הנמצא בין היבשות אסיה, אפריקה ואירופה. הים מחובר לאוקיינוס האטלנטי במצר גיברלטר במערב, לים השחור במצרי הדרדנלים והבוספורוס במזרח ולים סוף באמצעות תעלת סואץ בדרום מזרח. שטחו של הים מהווה משטח הימים והאוקיינוסים בעולם. הים התיכון מהווה יעד תיירותי לכשליש מכלל התייר"
CTM,Wiki,15,877,"פיקסלים בית העירייה הישן בכיכר השוק בלייפציג פיקסלים בניין האופרה של לייפציג לָיְיפְּצִיג בגרמנית בסורבית בגרמנית נהגה לָיְיפְּצִיך בעבר נקראה גם ליפסיא היא העיר הגדולה ביותר במדינת סקסוניה שבגרמניה והעיר ה בגודלה בגרמניה. נכון לשנת מונה לייפציג כ , תושבים. שם העיר נגזר מהמילה הסלבית שפירושה עץ תרזה. היסטוריה בלייפציג התגוררו בתחילת שנת כחצי מיליון תושבים. ב עברה העיר את קו ה , והפכה ל עיר גדולה ר"
CTM,Wiki,15,12243,"אולבני באנגלית היא בירת מדינת ניו יורק בארצות הברית. אולבני שוכנת ק מ צפונית לעיר ניו יורק מדרום למפגש הנהרות מוהוק והדסון. אולבני היא גם עיר המחוז של מחוז אולבני. העיר היא חלק ממטרופולין אולבני סקנקטדי טרוי. אף על פי שאולבני היא בירת מדינת ניו יורק, העיר הגדולה ביותר במדינה היא ניו יורק. היסטוריה האירופאי הראשון שהגיע לאזור היה הנרי הדסון בשנת , כאשר חקר עבור חברת הודו המזרחית ההולנדית. אולבני יד"
CTM,Wiki,15,17876,"שמאל על העיר מכיוון ההרים אלבקרקי באנגלית היא העיר הגדולה והמאוכלסת ביותר במדינת ניו מקסיקו שבארצות הברית. העיר היא מושב מחוז ברנליאו והיא שוכנת במרכז המדינה, על גדות נהר ריו גראנדה וממערב לרכס הרי סנדיה. נכון לשנת אוכלוסיית העיר מונה , תושבים, מה שהופך אותה לעיר ה בגודלה בארצות הברית והרביעית בגודלה בדרום מערב ארצות הברית. בשנת מנתה האוכלוסייה במטרופולין העיר , תושבים. כמחצית מאוכלוסיית ניו מקסיק"
CTM,Wiki,16,17114,"הראשון של חיל ההנדסה בצה ל מ חיל ההנדסה הקרבית הוקם ב והשתתף מאז בכל מלחמות ישראל, במבצעים רבים שנערכו בין המלחמות ובכלל פעילות הביטחון השוטף. הקמה חיילי הנדסה מתאמנים במסגרת חיל ההנדסה המלכותי בחיפה, דרך הגבורה דרך בורמה לזכר חללי חיל ההנדסה חיל ההנדסה הוקם על בסיס כוחות ההנדסה, הבנייה והחבלה של ההגנה וכן על כוחות מתנדבי היישוב היהודי בארץ ישראל לצבא הבריטי שהתגייסו במלחמת העולם השנייה ליחידות הש"
CTM,Wiki,16,10004,"הוא טנק אמפיבי קל שפותח בברית המועצות לאחר מלחמת העולם השנייה. הייצור התחיל בשנת ונפסק בשנות ה . הטנק שירת ומשרת בצבאות רבים בעולם, נחשב לאלטרנטיבה זולה לטנקי מערכה עיקריים והיה טנק הסיור הסטנדרטי של הצבא האדום עד החלפתו ב . ייצור הטנק היה מרוכז במפעל קירוב בלנינגרד ומפעל הטרקטורים בוולגוגרד. במלחמת ששת הימים תפס צה ל טנקי שלל והכניסם לשירות מבצעי. בין היתר פעלו הטנקים ביחידה דב לבן בחטיבה משוריינ"
CTM,Wiki,16,17195,"שמאל של קרב אוויר במהלך קרב מידווי, במלחמת העולם השנייה. הדיורמה מתארת מטוסי קרב של צי ארצות הברית בקרב עם מטוסי קרב של האימפריה היפנית מעל נושאת המטוסים יורקטאון, ביוני אלוף הפלות הוא טייס קרב שיירט הפיל מספר רב של מטוסים בקרבות אוויר. מספר המטוסים המקנה את הכינוי אלוף משתנה ממדינה למדינה, אך מקובל שהתואר ניתן למי שהפיל חמישה כלי טיס של האויב או יותר. התפתחות המונח שמאל ההפלות הראשון, אדולף פֶּגו"
CTM,Wiki,17,105,"השמש החדשה. כּוֹכַב לֶכֶת או פלנטה מיוונית , נע ונד הוא גרם שמיים, שאינו כוכב, המוגדר על פי האיגוד האסטרונומי הבין לאומי באופן הבא במערכת השמש נמצא במסלול קבוע סביב השמש בעל מסה גדולה דיה כדי שכוח המשיכה שלו יצור צורה הקרובה לצורה כדורית הוא מפנה את מסלולו מעצמים אחרים שגודלם קרוב לשלו. מחוץ למערכת השמש נמצא במסלול קבוע סביב כוכב או שאריות של כוכב המסה שלו מתחת למסה הדרושה להיתוך תרמו גרעיני של דא"
CTM,Wiki,17,1002,"מהירות היא גודל יחסי של גוף בתנועה. המהירות מודדת את המרחק אורך שעובר הגוף בזמן מסוים. אלה הן יחידות המידה הנפוצות למדידת מהירות מטר לשנייה יחידות זו יחידת למהירות סנטימטר לשנייה יחידות מייל לשעה מהירות של כלי רכב, בארצות הברית קילומטר לשעה מהירות של כלי רכב, בישראל ואירופה קילומטר לשנייה מהירות של חלליות וגרמי שמים קשר מהירות כלי שיט מאך מהירות כלי טיס מהירות האור בפיזיקה, למשל אם מהירות של אלקטר"
CTM,Wiki,17,56,"שמאל השמש לא בקנה מידה השמש, ארבעת כוכבי הלכת הארציים ניתן להבחין בירח סמוך לכדור הארץ , חגורת האסטרואידים, ארבעת ענקי הגזים, וכוכב הלכת הננסי פלוטו. כמו כן מופיע באיור שביט שנע במסלול בעל אקסצנטריות גבוהה ונראה בין מסלולו של צדק למסלולו של שבתאי שמאל מערכת השמש ומסלול פיוניר חלק מדיסקית פיוניר מַעֲרֶכֶת הַשֶּׁמֶשׁ היא מערכת כוכבי לכת, שבה מקיפים לפחות שמונה כוכבי לכת וגופים נוספים רבים את השמש בה"
CTM,Wiki,18,23500,"שמאל הכתרת לואי השמיני ובלאנש מקסטיליה בלנקה, נסיכת קסטיליה במרץ בנובמבר , הידועה גם בשם הצרפתי בלאנש, הייתה אשתו של לואי השמיני ואמו של לואי התשיעי, מלכי צרפת. ביוגרפיה בלנקה נולדה ב במרץ לאלפונסו השמיני, מלך קסטיליה ולאלינור מאנגליה, מלכת קסטיליה, בתם של הנרי השני מלך אנגליה ושל אלינור מאקוויטניה. בהיותה בת שנה, הביאה אותה סבתה אלינור מאקוויטניה לצרפת כדי להשיאה ללואי יורש העצר, בנו של המלך פילי"
CTM,Wiki,18,15589,"פסל של ג יימס השני בכיכר טרפלגר בלונדון. ג יימס השני, מלך אנגליה או ג יימס השביעי, מלך סקוטלנד באוקטובר בספטמבר היה מלך אנגליה, סקוטלנד ואירלנד מ בפברואר ועד למהפכה המהוללת ב . ג יימס היה המלך הקתולי האחרון שמלך באנגליה, סקוטלנד או אירלנד. ביוגרפיה ראשית חייו שמאל המלך צ ארלס הראשון וג יימס השני הצעיר , ציור מאת סר פיטר ללי ג יימס נולד ב באוקטובר בארמון סנט ג יימס בלונדון. הוא היה בנם השלישי של צ "
CTM,Wiki,18,1538,"בפברואר הוא היום ה בשנה, בשבוע ה בלוח הגרגוריאני. עד לסיום השנה, נשארו עוד ימים בשנה מעוברת . אירועים היסטוריים ביום זה יוליוס הראשון נבחר לאפיפיור הפיכת חצר באימפריה הסאסאנית אנשי אצולה וצבא תופסים את המלך הורמיז הרביעי, מעוורים אותו וכולאים אותו, ומעלים לשלטון את בנו, כוסרו פרוויז חיימה הראשון, מלך אראגון נישא ללאונור מקסטיליה ההולנדי אבל ינזון טסמן הוא האירופאי הראשון שמתעד הגעה לפיג י דוכס יור"
CTM,Wiki,19,2102,"ג ואן רולינג באנגלית , שם המשפחה מבוטא רָוְולִינְג נולדה ב ביולי , המוכרת בשם העט ג יי. קיי. רולינג . . , היא סופרת ופילנתרופית בריטית ילידת אנגליה, מחברת סדרת הספרים הנמכרת ביותר ברחבי תבל הארי פוטר . בזכות ספריה הפכה רולינג לאחת הנשים העשירות בבריטניה, ועל פי מגזין פורבס היא האדם הראשון בעולם שהפך למיליארדר מכתיבת ספרים. הסדרה והיא זכו להצלחה חריגה בגודלה ברחבי העולם ביחס לרבי מכר אחרים שקדמו לס"
CTM,Wiki,19,8573,"לה גווין עם הרלן אליסון במפגש סופרי מדע בדיוני במערב ארצות הברית, אורסולה קרובר לה גווין באנגלית באוקטובר בינואר הייתה סופרת אמריקאית, אשר כתבה בעיקר מדע בדיוני ופנטזיה, אך גם שירה, נובלות, ספרי ילדים ומאמרים, וכן תרגמה ספרים רבים לאנגלית. ידועה בכתיבתה הפמיניסטית, האנרכיסטית ובעלת המאפיינים הטאואיסטים. נחשבת לאחת מטובי סופרי הפנטזיה והמדע הבדיוני בעולם וזכתה במספר פרסי הוגו, וכן בפרסי נבולה, לוקו"
CTM,Wiki,19,13295,"פרס נבולה באנגלית הוא פרס ספרותי שניתן כל שנה מטעם אגודת סופרי המדע הבדיוני והפנטזיה של אמריקה לכותבי סיפורי המדע הבדיוני הטובים ביותר שפורסמו בארצות הברית במהלך השנתיים שקדמו לחלוקת הפרס. אין מדובר בפרס כספי, אלא רק בכבוד. עם זאת, המפרסמים של הספרים להוטים לציין שהספרים זכו בפרס זה, שכן העובדה שספר זכה בפרס זה, כמו בפרס הוגו, מביאה לעלייה במכירות הספרים. לעיתים קורה שבאותה שנה ניתנים הן פרס נבולה"
CTM,UGC,0,1711,"חיסול הוירוס . . בחיסונים חייבים להיות אדג ובנטים. אדג ובנטים אלה חומרים שתפקידם להמריץ את המערכת החיסונית כדי שתגיב כמה שיותר באפקטיביות לחיסון ותייצר כמה שיותר נוגדנים. ישנה סברה שלפעמים המערכת החיסונית מגיבה חזק מדיי ובאופו לא רצוי וכך מתפתחות מחלות אוטואימוניות. כחומר אדג ובנט משתמשים באלומיניום שהינו רעלן נוירולוגי . דווקא האלומיניום, אשר ביכולתו לעבור את מעטפת הדם המגנה על המוח , עומד במרכז "
CTM,UGC,0,59,"אלף? . בחיסונים חייבים להיות אדג ובנטים. אדג ובנטים אלה חומרים שתפקידם להמריץ את המערכת החיסונית כדי שתגיב כמה שיותר באפקטיביות לחיסון ותייצר כמה שיותר נוגדנים. ישנה סברה שלפעמים המערכת החיסונית מגיבה חזק מדיי ובאופו לא רצוי וכך מתפתחות מחלות אוטואימוניות. כחומר אדג ובנט משתמשים באלומיניום שהינו רעלן נוירולוגי . דווקא האלומיניום, אשר ביכולתו לעבור את מעטפת הדם המגנה על המוח , עומד במרכז ההיפותזה ש"
CTM,UGC,0,4117,האם חיסון זה יעיל ומונע התפתחות דלקת ריאותיש חיסון נגד דלקת ריאות. חיסון זה ניתן למבוגרים באופן חד פעמי. האם חיסון זה יעיל ומונע התפתחות דלקת ריאות למי שנדבק מקורונה?
CTM,UGC,1,2623,מה לא ברור ??? . אין אמא ואין אבא במשבר הזה אחרי שנתניהו הפקיר את מערכת הבריאות הציבורית בהיותו שר בריאות כאשר ליצמן סירב להיות שר רק סגן עד אשר אולץ להיות שר . הכישלון במשבר הזה שייך לנתניהו ההחלטות הם פוליטיות בלבד שלא לדבר על המשבר הכלכלי שהוא אסון
CTM,UGC,1,4724,ממשלה לא מתפקדת הפקרותמי שמנהל את הקורונה זו לא הממשלה לא שר הבריאות לא מנכל משרד הבריאות אלא חבורה של חברי כנסת בוועדה חוסר משילות מוחלט מפקירים את הבריאות של אזרחי המדינה
CTM,UGC,1,2324,להקים מיד ועדת חקירה ממלכתית לחקר מחדל הקורונה . בוז לראשי מערכת הבריאות בוז לראש הממשלה בוז לממשלה שהביאו עלינו את אסון הקורונה
CTM,UGC,2,5008,שוחד מרמה הפרת אמוניםשוחד מרמה הפרת אמונים שוחד מרמה הפרת אמונים שוחד מרמה הפרת אמונים שוחד מרמה הפרת אמונים שוחד מרמה הפרת אמונים שוחד מרמה הפרת אמונים שוחד מרמה הפרת אמונים שוחד מרמה הפרת אמונים שוחד מרמה הפרת אמונים שוחד מרמה הפרת אמונים שוחד מרמה הפרת אמונים
CTM,UGC,2,3855,"אין לנאשם נתניהו מנדט לשלוט, העם מביע בו אי אמון, ערב ערבאין לנאשם נתניהו מנדט לשלוט, העם מביע בו אי אמון, ערב ערב"
CTM,UGC,2,1715,"חכו חכו לביבי יש תמיד איזה שפן חדש שיוציא מהכובע בזה הוא מומ . בני גנץ לומד מהר, ביבי לעומת זאת משתחצן. ברור שהוא איבד את זה. עכשיו חוק של הרוב הדמוקרטי יאסור על מועמד לראשות ממשלה שעומד למשפט להקים ממשלה העבריין בדרכו הביתה. ההכרעה היא דמוקרטית הרוב דורש מראש הממשלה להיות נקי כפיים. ועכשיו תור בכייני הליכוד לקבל את הכרעת הרוב...."
CTM,UGC,3,854,בנט ליצן . סמוטריץ ולא בעד סיפוח.
CTM,UGC,3,2654,מה קורה עם בלוק הימין? אין בו יותר צורך אז מכפישים את ימינה
CTM,UGC,3,816,בנט אופוזיציונר מרשים... חבל שבחר בימין.
CTM,UGC,4,4632,"לצמצם מסכים לא עובד כרגע. משרד החינוך צריך לקנות מסך לכל ילדבמקום ש ח במזומן לכל ילד, לקנות טאבלט לכל ילד, ולארגן חיבור רשת מקוון לכולם. אין שום דבר חשוב יותר מזה במצב הנוכחי. ולאלה שאוהבים להיות בבית עם הילדים ולשחק מורים אם אתם לא מורים מקצועיים, רוב הסיכויים שאתם פוגעים בילדים שלכם בצורה הזאת. אולי יש מקרה אחד או שניים של כאלה שממש יודעים מה הם עושים אבל רוב ההורים לא מסוגלים לחנך בבית את הילדי"
CTM,UGC,4,3126,סיום לא ספורטיבי ולא הוגן! . סליחה. לא. לא מבין את ההמלצה של הוועדה המקצועית של איגוד הכדוריד על סיום ליגות הבוגרים .לסיום ליגת המשחקים של ליגת העל של הגברים נשארו משחקים סה כ קבוצות בודדות עם עוד משחק חסר . בגביע המדינה נשאר משחק הגמר בלבד. אפשר להחזיר את השחקנים הבוגרים לשבועיים שלוש של אימונים ותוך שבועיים נוספים אפשר לסיים את עונת הכדוריד בצורה ספורטיבית והוגנת עם הכרזה על אלופות ומחזיקות גביע
CTM,UGC,4,34,"מהפכה של ממש.... . הליגה כבר השנה תקוצר ל קבוצות בשנה הבאה סבב של משחקים והראשונה אלופהבין הליגות הראשונות קבוצות הראשונות יתקיים מפעל הגביע.גביע נטוטו מבוטל..לא תותר מכירת מנוייםהקהל יוגבל עד ובכול אופן ל איש בכול האצטדיון אדם בשורה אחת בין ריקות...שחקני הספסל יישבו ביציע, לא תותר לשחקן לירוק על הדשאשחקן שיפצע אפילו במעט דם לא תותר חזרתו למגרש גם בחבישתותינתן לכל קבוצה החלפה של עד שחקנים , השופט "
CTM,UGC,5,4848,סומך על קבוצת דלק שילמו היום !מלוא קרן וריבית אג ח י גסומך על תשובה וקבוצת דלק....שילמו היום !!! את מלוא אחוז הקרן וריבית . אחוז למחזיקי אג ח קבוצת דלק י ג כל הכבוד !!!!! ...גידור לחבית חשוב מאוד.....כל הכבוד
CTM,UGC,5,588,את סיפור השראה!!! . בחורה חכמה ויפה רק רציתי לומר שבת של עפה על מפרץ ההרפתקאות אז עשית עיסקה טובה!!! בהצלחה כפרה.
